{
  "format": 1,
  "rev": 23,
  "studio": "0.1.0",
  "name": "Supernova",
  "packageName": "celeros.supernova",
  "version": "3.1.2",
  "author": "CelerOS",
  "description": "Shooter vertical NATIVO do Celer Studio: campanha de 10 ondas com chefe a cada 5, modo infinito, tres vidas com nucleo de graze, combo x1..x5, orbes que carregam a SUPERNOVA (limpa a tela e causa 15 de dano), rajadas radiais com janela de escape, triplo apos chefes, pausa, recorde e cenas editaveis.",
  "type": "Game",
  "category": "Jogos",
  "api": 50,
  "requires": [
    "psram"
  ],
  "topbar": false,
  "permissions": [],
  "deps": {
    "celeros.game": "^1.7.0",
    "celeros.game.fx": "^1.4.2",
    "celeros.game.spr": "^1.7.0",
    "celeros.game.tilemap": "^1.3.0",
    "celeros.game.ui": "^1.3.0"
  },
  "changelog": "3.1.2: menu do titulo no E.ui.menuCard (engine 1.4) — CAMPANHA + chip de recorde ao lado + INFINITO, ancorado no rodape (o INFINITO era cortado pelo vidro de 480). Sem mudanca de jogabilidade.\n3.1.1: faiscas, anel do chefe, flash e o popText dos drops desenhados de verdade (o draw da cena nao chamava E.fx.draw; so o campo de estrelas aparecia).\n3.1.0: refeito com o kit de UI 1.3 e a arte nova do text2d. Cada inimigo tem nave propria em 48 px nativos (drone, sentinela, divisor, mini) e silhueta branca no golpe; Sentinela-mor ganha arte de chefe (112 px, 1 quadro de silhueta sob fogo). Explosao vfx de 6 quadros (a do chefe em 2x) com faiscas, anel e flash; drops de orbe, tiro triplo e vida (itens text2d). Nebulosa nova assada em 2x num slot e restaurada por blitSprite na camada suja (o Fundo antigo era um afim de 480 px por quadro); estrelas pelo E.fx.stars. HUD embaixo pelo E.ui.hud memoizado; pausa e SUPER (anel de carga) no alto; titulo, pausa e fim com card/badge/modal. Corrige o TypeError a cada tiro levado sem morrer (hurtPlayer zerava a lista que o laco percorria) e sentinela/divisor que atiravam todo quadro (cool nunca rearmava).\n3.0.2: nave e drone inimigo refeitos com text2d a partir dos sprites antigos; inimigo ganha pulso de escala no draw e o chefe/orbe continuam no atlas antigo.\n3.0.1: bases de asset incluem a pasta celeros_supernova criada pelo celerctl; atlas/fundo/titulo voltam a carregar no 4848.\n3.0.0: remake nativo no Celer Studio. Cenas Titulo/Campanha/Infinito/Vitoria/Fim; nave como entidade da cena; ondas, chefes com 3 fases, combo, orbes, supernova, triplo, graze hitbox, pausa, recorde salvo e modo infinito. Sem bridge legado e sem pools de inimigos na cena principal.",
  "canvas": {
    "w": 480,
    "h": 480,
    "native": true,
    "fps": 30,
    "inset": 0
  },
  "startScene": "147bef5ac8d85042589d068e23a50857",
  "build": {
    "out": ".studio/build",
    "splitKB": 96
  },
  "editor": {
    "grid": 8,
    "snap": true,
    "debug": false,
    "prof": false
  },
  "runtime": "studio"
}
