{
  "format": 1,
  "rev": 15,
  "studio": "0.1.0",
  "name": "Lenda de Celer",
  "packageName": "celeros.lenda",
  "version": "2.0.5",
  "author": "CelerOS",
  "description": "Remake NATIVO da Lenda de Celer no Celer Studio: as 20 salas ASCII (Campo, Gruta do Sabio e Templo) viram cenas com tilemap editavel e spawns como entidades. Espada, bomba, bumerangue, baus, Sabio, loja de cristais, paredes rachadas, guardiao com fases, save automatico, HUD e controles de toque.",
  "type": "Game",
  "category": "Aventura",
  "api": 50,
  "requires": [
    "psram"
  ],
  "topbar": false,
  "permissions": [],
  "deps": {
    "celeros.game": "^1.6.0",
    "celeros.game.fx": "^1.4.2",
    "celeros.game.spr": "^1.7.0",
    "celeros.game.tilemap": "^1.3.0"
  },
  "changelog": "2.0.5: desempenho: HUD memoizado fora da camada suja e recorte do mundo na faixa do jogo (corta a maior parte dos stamps/textos/repinturas por quadro), opcoes de sprite e nomes de frames reaproveitados no tilemap/heroina/inimigos, e o botao de pausa do HUD ganhou hitbox de verdade.\n2.0.4: o app.zip passa a levar o deps.json resolvido (celeros.game 1.6.0, fx 1.4.2, spr 1.7.0, tilemap 1.3.0); instalar o pacote direto nao deixa mais o require sem o cache e o jogo abre sem o erro \"modulo nao encontrado: celeros.game.js\".\n2.0.3: corpo da heroina permanece visivel durante o golpe; a espada (frames 6..9) virou overlay separado na direcao do ataque, com brilho na ponta, e inimigos atingidos ganham um anel branco.\n2.0.2: tilemap ancora no canto (corrige portas deslocadas e quadrados pretos), portas do Templo compostas com a parede e botoes A/B com icones de espada/bomba/bumerangue; itens carregados em todas as salas.\n2.0.1: bases de asset incluem a pasta celeros_lenda criada pelo celerctl; tileset/heroi/inimigos/itens/titulo voltam a carregar no 4848.\n2.0.0: remake nativo no Celer Studio. 20 salas como cenas (tilemap 15x13 + solidos por tile + spawns entidades), portais de borda/porta/escada/caverna/rachadura, heroina com andar/espada/bomba/bumerangue, polvo/morcego/esqueleto/geleia, Guardiao com fases, baus, Sabio, loja, save automatico, titulo/continuar, vitoria e fim. Sem bridge legado.",
  "canvas": {
    "w": 480,
    "h": 480,
    "native": true,
    "fps": 30,
    "inset": 0
  },
  "startScene": "21cad2170397329f66c2d6b87d490a39",
  "build": {
    "out": ".studio/build",
    "splitKB": 96
  },
  "editor": {
    "grid": 16,
    "snap": true,
    "debug": false,
    "prof": false
  },
  "runtime": "studio"
}
