{
  "format": 1,
  "rev": 6,
  "studio": "0.1.0",
  "name": "Arrasa!",
  "packageName": "celeros.arrasa",
  "version": "2.0.0",
  "author": "CelerOS",
  "description": "Remake NATIVO do Arrasa! no Celer Studio: 10 fases como cenas editaveis, com cada caixa/goblin/rei virando entidade e corpo do P.rigid. Estilingue, mira, 7 tipos de pedra (pedrao, tripla, flecha, bomba, chocadeira, bumerangue), TNT em cadeia, dano por impacto, estrelas, progresso salvo e HUD.",
  "type": "Game",
  "category": "Arcade",
  "api": 50,
  "requires": [
    "psram"
  ],
  "topbar": false,
  "permissions": [],
  "deps": {
    "celeros.game": "^1.6.0",
    "celeros.game.fx": "^1.4.2",
    "celeros.game.spr": "^1.7.0",
    "celeros.game.tilemap": "^1.3.0",
    "celeros.physics": "^2.1.1"
  },
  "changelog": "2.0.0: remake nativo no Celer Studio. As 10 fases do original viram cenas com pecas entidades (texturas giradas pelo runtime) e o controlador cria o mundo P.rigid; menus Titulo/Mapa/Fim, pausa, mira, poderes no toque, TNT, pontuacao/estrelas e progresso salvo. Sem bridge legado.",
  "canvas": {
    "w": 480,
    "h": 480,
    "native": true,
    "fps": 30,
    "inset": 0
  },
  "startScene": "bd454925a976696e95e50807d01cef05",
  "build": {
    "out": ".studio/build",
    "splitKB": 96
  },
  "editor": {
    "grid": 8,
    "snap": true,
    "debug": false,
    "prof": false
  },
  "runtime": "studio"
}
